{
  "format_version": 1,
  "trace_id": "pr009-before-finalize-continue",
  "initial_agent_spec": {
    "name": "fixture-agent"
  },
  "initial_session_records": [
    {
      "kind": "user_message",
      "id": "00000000-0000-7000-8000-00000000f001",
      "payload": {
        "session_id": "00000000-0000-7000-8000-00000000f002",
        "lane_id": "00000000-0000-7000-8000-00000000f003",
        "run_id": "00000000-0000-7000-8000-00000000f004",
        "timestamp_ms": 900,
        "text": "Say hello."
      }
    }
  ],
  "scripted_outcomes": {
    "format_version": 1,
    "steps": [
      {
        "kind": "model_chunk",
        "id": "00000000-0000-7000-8000-000000009101",
        "text": "draft response"
      },
      {
        "kind": "model_completed",
        "id": "completion-1"
      },
      {
        "kind": "before_finalize_continue",
        "message": "revise response"
      },
      {
        "kind": "model_chunk",
        "id": "00000000-0000-7000-8000-000000009102",
        "text": "final response"
      },
      {
        "kind": "model_completed",
        "id": "completion-2"
      }
    ]
  },
  "transition_env": {
    "timestamps_ms": [
      1000,
      1100,
      1200,
      1300,
      1400,
      1500,
      1600,
      1700,
      1800,
      1900,
      2000,
      2100
    ],
    "ids": [
      "00000000-0000-7000-8000-000000000001",
      "00000000-0000-7000-8000-000000000002",
      "00000000-0000-7000-8000-000000000003",
      "00000000-0000-7000-8000-000000000004",
      "00000000-0000-7000-8000-000000000005",
      "00000000-0000-7000-8000-000000000006",
      "00000000-0000-7000-8000-000000000007",
      "00000000-0000-7000-8000-000000000008",
      "00000000-0000-7000-8000-000000000009",
      "00000000-0000-7000-8000-000000000010",
      "00000000-0000-7000-8000-000000000011",
      "00000000-0000-7000-8000-000000000012",
      "00000000-0000-7000-8000-000000000013",
      "00000000-0000-7000-8000-000000000014",
      "00000000-0000-7000-8000-000000000015",
      "00000000-0000-7000-8000-000000000016",
      "00000000-0000-7000-8000-000000000017",
      "00000000-0000-7000-8000-000000000018",
      "00000000-0000-7000-8000-000000000019",
      "00000000-0000-7000-8000-000000000020",
      "00000000-0000-7000-8000-000000000021",
      "00000000-0000-7000-8000-000000000022",
      "00000000-0000-7000-8000-000000000023",
      "00000000-0000-7000-8000-000000000024",
      "00000000-0000-7000-8000-000000000025",
      "00000000-0000-7000-8000-000000000026",
      "00000000-0000-7000-8000-000000000027",
      "00000000-0000-7000-8000-000000000028",
      "00000000-0000-7000-8000-000000000029",
      "00000000-0000-7000-8000-000000000030",
      "00000000-0000-7000-8000-000000000031",
      "00000000-0000-7000-8000-000000000032",
      "00000000-0000-7000-8000-000000000033",
      "00000000-0000-7000-8000-000000000034",
      "00000000-0000-7000-8000-000000000035",
      "00000000-0000-7000-8000-000000000036",
      "00000000-0000-7000-8000-000000000037",
      "00000000-0000-7000-8000-000000000038",
      "00000000-0000-7000-8000-000000000039",
      "00000000-0000-7000-8000-000000000040",
      "00000000-0000-7000-8000-000000000041",
      "00000000-0000-7000-8000-000000000042",
      "00000000-0000-7000-8000-000000000043",
      "00000000-0000-7000-8000-000000000044",
      "00000000-0000-7000-8000-000000000045",
      "00000000-0000-7000-8000-000000000046",
      "00000000-0000-7000-8000-000000000047"
    ]
  },
  "expected": {
    "durable_records": [
      {
        "kind": "run_accepted",
        "id": "00000000-0000-7000-8000-000000000001"
      },
      {
        "kind": "stage_outcome_recorded",
        "id": "00000000-0000-7000-8000-000000000004"
      },
      {
        "kind": "stage_outcome_recorded",
        "id": "00000000-0000-7000-8000-000000000006"
      },
      {
        "kind": "context_prepared",
        "id": "00000000-0000-7000-8000-000000000007"
      },
      {
        "kind": "stage_outcome_recorded",
        "id": "00000000-0000-7000-8000-000000000010"
      },
      {
        "kind": "effect_requested",
        "id": "00000000-0000-7000-8000-000000000011"
      },
      {
        "kind": "effect_completed",
        "id": "00000000-0000-7000-8000-000000000016"
      },
      {
        "kind": "entry_appended",
        "id": "00000000-0000-7000-8000-000000000017"
      },
      {
        "kind": "stage_outcome_recorded",
        "id": "00000000-0000-7000-8000-000000000022"
      },
      {
        "kind": "stage_outcome_recorded",
        "id": "00000000-0000-7000-8000-000000000024"
      },
      {
        "kind": "stage_outcome_recorded",
        "id": "00000000-0000-7000-8000-000000000026"
      },
      {
        "kind": "context_prepared",
        "id": "00000000-0000-7000-8000-000000000027"
      },
      {
        "kind": "stage_outcome_recorded",
        "id": "00000000-0000-7000-8000-000000000030"
      },
      {
        "kind": "effect_requested",
        "id": "00000000-0000-7000-8000-000000000031"
      },
      {
        "kind": "effect_completed",
        "id": "00000000-0000-7000-8000-000000000036"
      },
      {
        "kind": "entry_appended",
        "id": "00000000-0000-7000-8000-000000000037"
      },
      {
        "kind": "stage_outcome_recorded",
        "id": "00000000-0000-7000-8000-000000000042"
      },
      {
        "kind": "stage_outcome_recorded",
        "id": "00000000-0000-7000-8000-000000000044"
      },
      {
        "kind": "run_completed",
        "id": "00000000-0000-7000-8000-000000000045"
      }
    ],
    "normalized_events": [
      {
        "kind": "run_accepted",
        "durability": "durable",
        "id": "00000000-0000-7000-8000-000000000002"
      },
      {
        "kind": "effect_requested",
        "durability": "durable",
        "id": "00000000-0000-7000-8000-000000000012"
      },
      {
        "kind": "model_text_delta",
        "durability": "transient",
        "id": "00000000-0000-7000-8000-000000009101",
        "payload": {
          "text": "draft response"
        }
      },
      {
        "kind": "effect_completed",
        "durability": "durable",
        "id": "00000000-0000-7000-8000-000000000018"
      },
      {
        "kind": "message_finalized",
        "durability": "durable",
        "id": "00000000-0000-7000-8000-000000000019"
      },
      {
        "kind": "effect_requested",
        "durability": "durable",
        "id": "00000000-0000-7000-8000-000000000032"
      },
      {
        "kind": "model_text_delta",
        "durability": "transient",
        "id": "00000000-0000-7000-8000-000000009102",
        "payload": {
          "text": "final response"
        }
      },
      {
        "kind": "effect_completed",
        "durability": "durable",
        "id": "00000000-0000-7000-8000-000000000038"
      },
      {
        "kind": "message_finalized",
        "durability": "durable",
        "id": "00000000-0000-7000-8000-000000000039"
      },
      {
        "kind": "run_completed",
        "durability": "durable",
        "id": "00000000-0000-7000-8000-000000000046"
      }
    ],
    "effects": [
      {
        "kind": "execute_effect",
        "id": "00000000-0000-7000-8000-000000000013"
      },
      {
        "kind": "execute_effect",
        "id": "00000000-0000-7000-8000-000000000033"
      }
    ],
    "final_state": {
      "cycle": 1,
      "last_applied_sequence": 19,
      "message_ids": [
        "00000000-0000-7000-8000-000000000020",
        "00000000-0000-7000-8000-000000000040"
      ],
      "phase": "completed"
    },
    "final_result": {
      "completed": {
        "cycle": 1,
        "effect_id": "00000000-0000-7000-8000-000000000033",
        "model_request_id": "00000000-0000-7000-8000-000000000034",
        "result_digest": "3934256b04b080e26d83295a24ae9a958c35a5866dde5131bf94efdfe22e1f9c",
        "result_message_id": "00000000-0000-7000-8000-000000000040",
        "turn_id": "00000000-0000-7000-8000-000000000028"
      }
    },
    "state_hash": "39b343b7925f315d66a26be1b317c20fdd30d759d379e4244b0889ce1b007a49"
  }
}
