{
  "format_version": 1,
  "trace_id": "pr009-model-deferred",
  "initial_agent_spec": {
    "name": "fixture-agent"
  },
  "initial_session_records": [
    {
      "kind": "user_message",
      "id": "00000000-0000-7000-8000-00000000f001",
      "payload": {
        "session_id": "00000000-0000-7000-8000-00000000f002",
        "lane_id": "00000000-0000-7000-8000-00000000f003",
        "run_id": "00000000-0000-7000-8000-00000000f004",
        "timestamp_ms": 900,
        "text": "Say hello."
      }
    }
  ],
  "scripted_outcomes": {
    "format_version": 1,
    "steps": [
      {
        "kind": "model_deferred",
        "id": "external-handle-1"
      },
      {
        "kind": "external_completed",
        "id": "external-completion-1",
        "text": "hello world"
      }
    ]
  },
  "transition_env": {
    "timestamps_ms": [
      1000,
      1100,
      1200,
      1300,
      1400,
      1500,
      1600,
      1700
    ],
    "ids": [
      "00000000-0000-7000-8000-000000000001",
      "00000000-0000-7000-8000-000000000002",
      "00000000-0000-7000-8000-000000000003",
      "00000000-0000-7000-8000-000000000004",
      "00000000-0000-7000-8000-000000000005",
      "00000000-0000-7000-8000-000000000006",
      "00000000-0000-7000-8000-000000000007",
      "00000000-0000-7000-8000-000000000008",
      "00000000-0000-7000-8000-000000000009",
      "00000000-0000-7000-8000-000000000010",
      "00000000-0000-7000-8000-000000000011",
      "00000000-0000-7000-8000-000000000012",
      "00000000-0000-7000-8000-000000000013",
      "00000000-0000-7000-8000-000000000014",
      "00000000-0000-7000-8000-000000000015",
      "00000000-0000-7000-8000-000000000016",
      "00000000-0000-7000-8000-000000000017",
      "00000000-0000-7000-8000-000000000018",
      "00000000-0000-7000-8000-000000000019",
      "00000000-0000-7000-8000-000000000020",
      "00000000-0000-7000-8000-000000000021",
      "00000000-0000-7000-8000-000000000022",
      "00000000-0000-7000-8000-000000000023",
      "00000000-0000-7000-8000-000000000024",
      "00000000-0000-7000-8000-000000000025",
      "00000000-0000-7000-8000-000000000026",
      "00000000-0000-7000-8000-000000000027",
      "00000000-0000-7000-8000-000000000028",
      "00000000-0000-7000-8000-000000000029",
      "00000000-0000-7000-8000-000000000030"
    ]
  },
  "expected": {
    "durable_records": [
      {
        "kind": "run_accepted",
        "id": "00000000-0000-7000-8000-000000000001"
      },
      {
        "kind": "stage_outcome_recorded",
        "id": "00000000-0000-7000-8000-000000000004"
      },
      {
        "kind": "stage_outcome_recorded",
        "id": "00000000-0000-7000-8000-000000000006"
      },
      {
        "kind": "context_prepared",
        "id": "00000000-0000-7000-8000-000000000007"
      },
      {
        "kind": "stage_outcome_recorded",
        "id": "00000000-0000-7000-8000-000000000010"
      },
      {
        "kind": "effect_requested",
        "id": "00000000-0000-7000-8000-000000000011"
      },
      {
        "kind": "effect_deferred",
        "id": "00000000-0000-7000-8000-000000000016"
      },
      {
        "kind": "effect_completed",
        "id": "00000000-0000-7000-8000-000000000019"
      },
      {
        "kind": "entry_appended",
        "id": "00000000-0000-7000-8000-000000000020"
      },
      {
        "kind": "stage_outcome_recorded",
        "id": "00000000-0000-7000-8000-000000000025"
      },
      {
        "kind": "stage_outcome_recorded",
        "id": "00000000-0000-7000-8000-000000000027"
      },
      {
        "kind": "run_completed",
        "id": "00000000-0000-7000-8000-000000000028"
      }
    ],
    "normalized_events": [
      {
        "kind": "run_accepted",
        "durability": "durable",
        "id": "00000000-0000-7000-8000-000000000002"
      },
      {
        "kind": "effect_requested",
        "durability": "durable",
        "id": "00000000-0000-7000-8000-000000000012"
      },
      {
        "kind": "effect_deferred",
        "durability": "durable",
        "id": "00000000-0000-7000-8000-000000000017"
      },
      {
        "kind": "effect_completed",
        "durability": "durable",
        "id": "00000000-0000-7000-8000-000000000021"
      },
      {
        "kind": "message_finalized",
        "durability": "durable",
        "id": "00000000-0000-7000-8000-000000000022"
      },
      {
        "kind": "run_completed",
        "durability": "durable",
        "id": "00000000-0000-7000-8000-000000000029"
      }
    ],
    "effects": [
      {
        "kind": "execute_effect",
        "id": "00000000-0000-7000-8000-000000000013"
      }
    ],
    "final_state": {
      "cycle": 0,
      "last_applied_sequence": 12,
      "message_ids": [
        "00000000-0000-7000-8000-000000000023"
      ],
      "phase": "completed"
    },
    "final_result": {
      "completed": {
        "cycle": 0,
        "effect_id": "00000000-0000-7000-8000-000000000013",
        "model_request_id": "00000000-0000-7000-8000-000000000014",
        "result_digest": "99a1e0870c45ac1adc1139dfe755697076775fe75dfc95054951a59b39045ba9",
        "result_message_id": "00000000-0000-7000-8000-000000000023",
        "turn_id": "00000000-0000-7000-8000-000000000008"
      }
    },
    "state_hash": "d4bfdb61087556bf76e4ebe726ed58f72e703dfa8131176736bbf55777366c2b"
  }
}
